{
  "kind": "assignment",
  "schema_version": "1.0.0",
  "id": "A-HARBORAPI",
  "record_status": "EXAMPLE",
  "epoch_id": "E-HARBORAPI",
  "status": "LOCKED",
  "subject_id": "HARBORAPI",
  "subject_digest": "sha256:887e3f510204be19688947b91fc3df3251a2f6ae95e2290705123bd932e5eb04",
  "mandate_ref": "SCENARIO-MANDATE-NOT-ACTUAL-AUTHORITY",
  "intent_ref": "dossier.json",
  "catalog_digest": "sha256:1d6e8a8f14423a541573c0c95b4921979b6da8ba01596a8268b93f6650002e58",
  "profile_id": "bootstrap",
  "coverage_statement": "14 deliberately selected criteria for this fictional bounded slice. Other catalog criteria remain unassessed; omitted is not not-applicable.",
  "created_at": "2026-09-11T23:19:57.136661+00:00",
  "scope_review_status": "ACCEPTED",
  "scope_review_ref": "SCENARIO-SCOPE-ASSUMPTION",
  "instances": [
    {
      "id": "I-01",
      "criterion_id": "PEP-05-01-01",
      "criterion_revision": "1.0.0",
      "obligation_key": "PEP-05-01-01",
      "scope": "Local single-operator service plus a distinct proposed hosted deployment; never combine their readiness.",
      "applicability": "APPLICABLE",
      "applicability_reason": "Capability is required by the stated fictional slice.",
      "applicability_decision_ref": "SCENARIO-SCOPE-ASSUMPTION",
      "weight": 1,
      "mandatory": true,
      "measurement_binding_ref": "measurement-bindings/MB-I-01.json"
    },
    {
      "id": "I-02",
      "criterion_id": "PEP-05-01-04",
      "criterion_revision": "1.0.0",
      "obligation_key": "PEP-05-01-04",
      "scope": "Local single-operator service plus a distinct proposed hosted deployment; never combine their readiness.",
      "applicability": "APPLICABLE",
      "applicability_reason": "Capability is required by the stated fictional slice.",
      "applicability_decision_ref": "SCENARIO-SCOPE-ASSUMPTION",
      "weight": 1,
      "mandatory": true,
      "measurement_binding_ref": "measurement-bindings/MB-I-02.json"
    },
    {
      "id": "I-03",
      "criterion_id": "PEP-14-02-01",
      "criterion_revision": "1.0.0",
      "obligation_key": "PEP-14-02-01",
      "scope": "Local single-operator service plus a distinct proposed hosted deployment; never combine their readiness.",
      "applicability": "APPLICABLE",
      "applicability_reason": "Capability is required by the stated fictional slice.",
      "applicability_decision_ref": "SCENARIO-SCOPE-ASSUMPTION",
      "weight": 1,
      "mandatory": true,
      "measurement_binding_ref": "measurement-bindings/MB-I-03.json"
    },
    {
      "id": "I-04",
      "criterion_id": "PEP-03-03-06",
      "criterion_revision": "1.0.0",
      "obligation_key": "PEP-03-03-06",
      "scope": "Local single-operator service plus a distinct proposed hosted deployment; never combine their readiness.",
      "applicability": "APPLICABLE",
      "applicability_reason": "Capability is required by the stated fictional slice.",
      "applicability_decision_ref": "SCENARIO-SCOPE-ASSUMPTION",
      "weight": 1,
      "mandatory": true,
      "measurement_binding_ref": "measurement-bindings/MB-I-04.json"
    },
    {
      "id": "I-05",
      "criterion_id": "PEP-13-01-10",
      "criterion_revision": "1.0.0",
      "obligation_key": "PEP-13-01-10",
      "scope": "Local single-operator service plus a distinct proposed hosted deployment; never combine their readiness.",
      "applicability": "APPLICABLE",
      "applicability_reason": "Capability is required by the stated fictional slice.",
      "applicability_decision_ref": "SCENARIO-SCOPE-ASSUMPTION",
      "weight": 1,
      "mandatory": false,
      "measurement_binding_ref": "measurement-bindings/MB-I-05.json"
    },
    {
      "id": "I-06",
      "criterion_id": "PEP-07-01-05",
      "criterion_revision": "1.0.0",
      "obligation_key": "PEP-07-01-05",
      "scope": "Local single-operator service plus a distinct proposed hosted deployment; never combine their readiness.",
      "applicability": "APPLICABLE",
      "applicability_reason": "Capability is required by the stated fictional slice.",
      "applicability_decision_ref": "SCENARIO-SCOPE-ASSUMPTION",
      "weight": 1,
      "mandatory": false,
      "measurement_binding_ref": "measurement-bindings/MB-I-06.json"
    },
    {
      "id": "I-07",
      "criterion_id": "PEP-16-03-03",
      "criterion_revision": "1.0.0",
      "obligation_key": "PEP-16-03-03",
      "scope": "Local single-operator service plus a distinct proposed hosted deployment; never combine their readiness.",
      "applicability": "APPLICABLE",
      "applicability_reason": "Capability is required by the stated fictional slice.",
      "applicability_decision_ref": "SCENARIO-SCOPE-ASSUMPTION",
      "weight": 1,
      "mandatory": true,
      "measurement_binding_ref": "measurement-bindings/MB-I-07.json"
    },
    {
      "id": "I-08",
      "criterion_id": "PEP-16-03-04",
      "criterion_revision": "1.0.0",
      "obligation_key": "PEP-16-03-04",
      "scope": "Local single-operator service plus a distinct proposed hosted deployment; never combine their readiness.",
      "applicability": "APPLICABLE",
      "applicability_reason": "Capability is required by the stated fictional slice.",
      "applicability_decision_ref": "SCENARIO-SCOPE-ASSUMPTION",
      "weight": 1,
      "mandatory": true,
      "measurement_binding_ref": "measurement-bindings/MB-I-08.json"
    },
    {
      "id": "I-09",
      "criterion_id": "PEP-16-03-05",
      "criterion_revision": "1.0.0",
      "obligation_key": "PEP-16-03-05",
      "scope": "Local single-operator service plus a distinct proposed hosted deployment; never combine their readiness.",
      "applicability": "APPLICABLE",
      "applicability_reason": "Capability is required by the stated fictional slice.",
      "applicability_decision_ref": "SCENARIO-SCOPE-ASSUMPTION",
      "weight": 1,
      "mandatory": true,
      "measurement_binding_ref": "measurement-bindings/MB-I-09.json"
    },
    {
      "id": "I-10",
      "criterion_id": "PEP-16-03-06",
      "criterion_revision": "1.0.0",
      "obligation_key": "PEP-16-03-06",
      "scope": "Local single-operator service plus a distinct proposed hosted deployment; never combine their readiness.",
      "applicability": "APPLICABLE",
      "applicability_reason": "Capability is required by the stated fictional slice.",
      "applicability_decision_ref": "SCENARIO-SCOPE-ASSUMPTION",
      "weight": 1,
      "mandatory": true,
      "measurement_binding_ref": "measurement-bindings/MB-I-10.json"
    },
    {
      "id": "I-11",
      "criterion_id": "PEP-16-03-10",
      "criterion_revision": "1.0.0",
      "obligation_key": "PEP-16-03-10",
      "scope": "Local single-operator service plus a distinct proposed hosted deployment; never combine their readiness.",
      "applicability": "APPLICABLE",
      "applicability_reason": "Capability is required by the stated fictional slice.",
      "applicability_decision_ref": "SCENARIO-SCOPE-ASSUMPTION",
      "weight": 1,
      "mandatory": false,
      "measurement_binding_ref": "measurement-bindings/MB-I-11.json"
    },
    {
      "id": "I-12",
      "criterion_id": "PEP-08-02-10",
      "criterion_revision": "1.0.0",
      "obligation_key": "PEP-08-02-10",
      "scope": "Local single-operator service plus a distinct proposed hosted deployment; never combine their readiness.",
      "applicability": "APPLICABLE",
      "applicability_reason": "Capability is required by the stated fictional slice.",
      "applicability_decision_ref": "SCENARIO-SCOPE-ASSUMPTION",
      "weight": 1,
      "mandatory": false,
      "measurement_binding_ref": "measurement-bindings/MB-I-12.json"
    },
    {
      "id": "I-13",
      "criterion_id": "PEP-12-01-10",
      "criterion_revision": "1.0.0",
      "obligation_key": "PEP-12-01-10",
      "scope": "Local single-operator service plus a distinct proposed hosted deployment; never combine their readiness.",
      "applicability": "APPLICABLE",
      "applicability_reason": "Capability is required by the stated fictional slice.",
      "applicability_decision_ref": "SCENARIO-SCOPE-ASSUMPTION",
      "weight": 1,
      "mandatory": false,
      "measurement_binding_ref": "measurement-bindings/MB-I-13.json"
    },
    {
      "id": "I-14",
      "criterion_id": "PEP-14-01-02",
      "criterion_revision": "1.0.0",
      "obligation_key": "PEP-14-01-02",
      "scope": "Local single-operator service plus a distinct proposed hosted deployment; never combine their readiness.",
      "applicability": "UNRESOLVED",
      "applicability_reason": "Multi-tenant exposure may apply, but the hosted slice and ownership boundary are unresolved.",
      "applicability_decision_ref": null,
      "weight": 1,
      "mandatory": true,
      "measurement_binding_ref": "measurement-bindings/MB-I-14.json"
    }
  ],
  "gates": [
    {
      "id": "LOCAL-SLICE",
      "required_instance_ids": [
        "I-01",
        "I-02",
        "I-03",
        "I-04"
      ]
    },
    {
      "id": "HOSTED-RELEASE",
      "required_instance_ids": [
        "I-07",
        "I-08",
        "I-09",
        "I-10",
        "I-14"
      ]
    }
  ]
}
