{
  "kind": "assignment",
  "schema_version": "1.0.0",
  "id": "REPLACE_WITH_ASSIGNMENT_ID",
  "record_status": "TEMPLATE",
  "epoch_id": "REPLACE_WITH_EPOCH",
  "status": "PROPOSED",
  "subject_id": "REPLACE_WITH_SUBJECT_LABEL",
  "subject_digest": "sha256:d161a2237577766d9b819dc3631345ad5cbba82c157a00761103ab0865388877",
  "mandate_ref": "REPLACE_WITH_ACTUAL_MANDATE",
  "intent_ref": "REPLACE_WITH_INTENT",
  "catalog_digest": "sha256:1d6e8a8f14423a541573c0c95b4921979b6da8ba01596a8268b93f6650002e58",
  "profile_id": "bootstrap",
  "coverage_statement": "Initial 12-entry selection; review profile and capability risks before locking. Remaining catalog is unassessed.",
  "created_at": "2026-09-11T23:22:49.917121+00:00",
  "scope_review_status": "PENDING",
  "scope_review_ref": null,
  "instances": [
    {
      "id": "I-1",
      "criterion_id": "PEP-01-01-01",
      "criterion_revision": "1.0.0",
      "obligation_key": "PEP-01-01-01",
      "scope": "REPLACE_WITH_BOUNDED_SCOPE",
      "applicability": "UNRESOLVED",
      "applicability_reason": "Needs capability-based decision",
      "applicability_decision_ref": null,
      "weight": 1,
      "mandatory": false,
      "measurement_binding_ref": null
    },
    {
      "id": "I-2",
      "criterion_id": "PEP-01-02-01",
      "criterion_revision": "1.0.0",
      "obligation_key": "PEP-01-02-01",
      "scope": "REPLACE_WITH_BOUNDED_SCOPE",
      "applicability": "UNRESOLVED",
      "applicability_reason": "Needs capability-based decision",
      "applicability_decision_ref": null,
      "weight": 1,
      "mandatory": false,
      "measurement_binding_ref": null
    },
    {
      "id": "I-3",
      "criterion_id": "PEP-01-03-01",
      "criterion_revision": "1.0.0",
      "obligation_key": "PEP-01-03-01",
      "scope": "REPLACE_WITH_BOUNDED_SCOPE",
      "applicability": "UNRESOLVED",
      "applicability_reason": "Needs capability-based decision",
      "applicability_decision_ref": null,
      "weight": 1,
      "mandatory": false,
      "measurement_binding_ref": null
    },
    {
      "id": "I-4",
      "criterion_id": "PEP-01-04-02",
      "criterion_revision": "1.0.0",
      "obligation_key": "PEP-01-04-02",
      "scope": "REPLACE_WITH_BOUNDED_SCOPE",
      "applicability": "UNRESOLVED",
      "applicability_reason": "Needs capability-based decision",
      "applicability_decision_ref": null,
      "weight": 1,
      "mandatory": false,
      "measurement_binding_ref": null
    },
    {
      "id": "I-5",
      "criterion_id": "PEP-03-02-02",
      "criterion_revision": "1.0.0",
      "obligation_key": "PEP-03-02-02",
      "scope": "REPLACE_WITH_BOUNDED_SCOPE",
      "applicability": "UNRESOLVED",
      "applicability_reason": "Needs capability-based decision",
      "applicability_decision_ref": null,
      "weight": 1,
      "mandatory": false,
      "measurement_binding_ref": null
    },
    {
      "id": "I-6",
      "criterion_id": "PEP-03-03-04",
      "criterion_revision": "1.0.0",
      "obligation_key": "PEP-03-03-04",
      "scope": "REPLACE_WITH_BOUNDED_SCOPE",
      "applicability": "UNRESOLVED",
      "applicability_reason": "Needs capability-based decision",
      "applicability_decision_ref": null,
      "weight": 1,
      "mandatory": false,
      "measurement_binding_ref": null
    },
    {
      "id": "I-7",
      "criterion_id": "PEP-06-02-01",
      "criterion_revision": "1.0.0",
      "obligation_key": "PEP-06-02-01",
      "scope": "REPLACE_WITH_BOUNDED_SCOPE",
      "applicability": "UNRESOLVED",
      "applicability_reason": "Needs capability-based decision",
      "applicability_decision_ref": null,
      "weight": 1,
      "mandatory": false,
      "measurement_binding_ref": null
    },
    {
      "id": "I-8",
      "criterion_id": "PEP-06-02-02",
      "criterion_revision": "1.0.0",
      "obligation_key": "PEP-06-02-02",
      "scope": "REPLACE_WITH_BOUNDED_SCOPE",
      "applicability": "UNRESOLVED",
      "applicability_reason": "Needs capability-based decision",
      "applicability_decision_ref": null,
      "weight": 1,
      "mandatory": false,
      "measurement_binding_ref": null
    },
    {
      "id": "I-9",
      "criterion_id": "PEP-17-02-01",
      "criterion_revision": "1.0.0",
      "obligation_key": "PEP-17-02-01",
      "scope": "REPLACE_WITH_BOUNDED_SCOPE",
      "applicability": "UNRESOLVED",
      "applicability_reason": "Needs capability-based decision",
      "applicability_decision_ref": null,
      "weight": 1,
      "mandatory": false,
      "measurement_binding_ref": null
    },
    {
      "id": "I-10",
      "criterion_id": "PEP-17-03-01",
      "criterion_revision": "1.0.0",
      "obligation_key": "PEP-17-03-01",
      "scope": "REPLACE_WITH_BOUNDED_SCOPE",
      "applicability": "UNRESOLVED",
      "applicability_reason": "Needs capability-based decision",
      "applicability_decision_ref": null,
      "weight": 1,
      "mandatory": false,
      "measurement_binding_ref": null
    },
    {
      "id": "I-11",
      "criterion_id": "PEP-17-04-01",
      "criterion_revision": "1.0.0",
      "obligation_key": "PEP-17-04-01",
      "scope": "REPLACE_WITH_BOUNDED_SCOPE",
      "applicability": "UNRESOLVED",
      "applicability_reason": "Needs capability-based decision",
      "applicability_decision_ref": null,
      "weight": 1,
      "mandatory": false,
      "measurement_binding_ref": null
    },
    {
      "id": "I-12",
      "criterion_id": "PEP-18-01-04",
      "criterion_revision": "1.0.0",
      "obligation_key": "PEP-18-01-04",
      "scope": "REPLACE_WITH_BOUNDED_SCOPE",
      "applicability": "UNRESOLVED",
      "applicability_reason": "Needs capability-based decision",
      "applicability_decision_ref": null,
      "weight": 1,
      "mandatory": false,
      "measurement_binding_ref": null
    }
  ],
  "gates": []
}
