{
  "kind": "assignment",
  "schema_version": "1.0.0",
  "id": "A-RELAYSUITE",
  "record_status": "EXAMPLE",
  "epoch_id": "E-RELAYSUITE",
  "status": "LOCKED",
  "subject_id": "RELAYSUITE",
  "subject_digest": "sha256:f8bea6ef0d129c7caf37f2343fb37100d7eff60445f4b5616ddd4845bba065c6",
  "mandate_ref": "SCENARIO-MANDATE-NOT-ACTUAL-AUTHORITY",
  "intent_ref": "dossier.json",
  "catalog_digest": "sha256:1d6e8a8f14423a541573c0c95b4921979b6da8ba01596a8268b93f6650002e58",
  "profile_id": "bootstrap",
  "coverage_statement": "12 deliberately selected criteria for this fictional bounded slice. Other catalog criteria remain unassessed; omitted is not not-applicable.",
  "created_at": "2026-09-11T23:19:57.136661+00:00",
  "scope_review_status": "ACCEPTED",
  "scope_review_ref": "SCENARIO-SCOPE-ASSUMPTION",
  "instances": [
    {
      "id": "I-01",
      "criterion_id": "PEP-04-06-01",
      "criterion_revision": "1.0.0",
      "obligation_key": "PEP-04-06-01",
      "scope": "Pinned producer → queue → worker → consumer composition; four fictional components.",
      "applicability": "APPLICABLE",
      "applicability_reason": "Capability is required by the stated fictional slice.",
      "applicability_decision_ref": "SCENARIO-SCOPE-ASSUMPTION",
      "weight": 1,
      "mandatory": true,
      "measurement_binding_ref": "measurement-bindings/MB-I-01.json"
    },
    {
      "id": "I-02",
      "criterion_id": "PEP-04-06-02",
      "criterion_revision": "1.0.0",
      "obligation_key": "PEP-04-06-02",
      "scope": "Pinned producer → queue → worker → consumer composition; four fictional components.",
      "applicability": "APPLICABLE",
      "applicability_reason": "Capability is required by the stated fictional slice.",
      "applicability_decision_ref": "SCENARIO-SCOPE-ASSUMPTION",
      "weight": 1,
      "mandatory": false,
      "measurement_binding_ref": "measurement-bindings/MB-I-02.json"
    },
    {
      "id": "I-03",
      "criterion_id": "PEP-04-02-01",
      "criterion_revision": "1.0.0",
      "obligation_key": "PEP-04-02-01",
      "scope": "Pinned producer → queue → worker → consumer composition; four fictional components.",
      "applicability": "APPLICABLE",
      "applicability_reason": "Capability is required by the stated fictional slice.",
      "applicability_decision_ref": "SCENARIO-SCOPE-ASSUMPTION",
      "weight": 1,
      "mandatory": true,
      "measurement_binding_ref": "measurement-bindings/MB-I-03.json"
    },
    {
      "id": "I-04",
      "criterion_id": "PEP-04-02-02",
      "criterion_revision": "1.0.0",
      "obligation_key": "PEP-04-02-02",
      "scope": "Pinned producer → queue → worker → consumer composition; four fictional components.",
      "applicability": "APPLICABLE",
      "applicability_reason": "Capability is required by the stated fictional slice.",
      "applicability_decision_ref": "SCENARIO-SCOPE-ASSUMPTION",
      "weight": 1,
      "mandatory": true,
      "measurement_binding_ref": "measurement-bindings/MB-I-04.json"
    },
    {
      "id": "I-05",
      "criterion_id": "PEP-04-02-05",
      "criterion_revision": "1.0.0",
      "obligation_key": "PEP-04-02-05",
      "scope": "Pinned producer → queue → worker → consumer composition; four fictional components.",
      "applicability": "APPLICABLE",
      "applicability_reason": "Capability is required by the stated fictional slice.",
      "applicability_decision_ref": "SCENARIO-SCOPE-ASSUMPTION",
      "weight": 1,
      "mandatory": true,
      "measurement_binding_ref": "measurement-bindings/MB-I-05.json"
    },
    {
      "id": "I-06",
      "criterion_id": "PEP-04-06-04",
      "criterion_revision": "1.0.0",
      "obligation_key": "PEP-04-06-04",
      "scope": "Pinned producer → queue → worker → consumer composition; four fictional components.",
      "applicability": "APPLICABLE",
      "applicability_reason": "Capability is required by the stated fictional slice.",
      "applicability_decision_ref": "SCENARIO-SCOPE-ASSUMPTION",
      "weight": 1,
      "mandatory": false,
      "measurement_binding_ref": "measurement-bindings/MB-I-06.json"
    },
    {
      "id": "I-07",
      "criterion_id": "PEP-04-06-05",
      "criterion_revision": "1.0.0",
      "obligation_key": "PEP-04-06-05",
      "scope": "Pinned producer → queue → worker → consumer composition; four fictional components.",
      "applicability": "APPLICABLE",
      "applicability_reason": "Capability is required by the stated fictional slice.",
      "applicability_decision_ref": "SCENARIO-SCOPE-ASSUMPTION",
      "weight": 1,
      "mandatory": false,
      "measurement_binding_ref": "measurement-bindings/MB-I-07.json"
    },
    {
      "id": "I-08",
      "criterion_id": "PEP-04-06-06",
      "criterion_revision": "1.0.0",
      "obligation_key": "PEP-04-06-06",
      "scope": "Pinned producer → queue → worker → consumer composition; four fictional components.",
      "applicability": "APPLICABLE",
      "applicability_reason": "Capability is required by the stated fictional slice.",
      "applicability_decision_ref": "SCENARIO-SCOPE-ASSUMPTION",
      "weight": 1,
      "mandatory": false,
      "measurement_binding_ref": "measurement-bindings/MB-I-08.json"
    },
    {
      "id": "I-09",
      "criterion_id": "PEP-04-06-07",
      "criterion_revision": "1.0.0",
      "obligation_key": "PEP-04-06-07",
      "scope": "Pinned producer → queue → worker → consumer composition; four fictional components.",
      "applicability": "APPLICABLE",
      "applicability_reason": "Capability is required by the stated fictional slice.",
      "applicability_decision_ref": "SCENARIO-SCOPE-ASSUMPTION",
      "weight": 1,
      "mandatory": true,
      "measurement_binding_ref": "measurement-bindings/MB-I-09.json"
    },
    {
      "id": "I-10",
      "criterion_id": "PEP-04-06-09",
      "criterion_revision": "1.0.0",
      "obligation_key": "PEP-04-06-09",
      "scope": "Pinned producer → queue → worker → consumer composition; four fictional components.",
      "applicability": "APPLICABLE",
      "applicability_reason": "Capability is required by the stated fictional slice.",
      "applicability_decision_ref": "SCENARIO-SCOPE-ASSUMPTION",
      "weight": 1,
      "mandatory": false,
      "measurement_binding_ref": "measurement-bindings/MB-I-10.json"
    },
    {
      "id": "I-11",
      "criterion_id": "PEP-04-06-10",
      "criterion_revision": "1.0.0",
      "obligation_key": "PEP-04-06-10",
      "scope": "Pinned producer → queue → worker → consumer composition; four fictional components.",
      "applicability": "APPLICABLE",
      "applicability_reason": "Capability is required by the stated fictional slice.",
      "applicability_decision_ref": "SCENARIO-SCOPE-ASSUMPTION",
      "weight": 1,
      "mandatory": false,
      "measurement_binding_ref": "measurement-bindings/MB-I-11.json"
    },
    {
      "id": "I-12",
      "criterion_id": "PEP-01-04-06",
      "criterion_revision": "1.0.0",
      "obligation_key": "PEP-01-04-06",
      "scope": "Pinned producer → queue → worker → consumer composition; four fictional components.",
      "applicability": "APPLICABLE",
      "applicability_reason": "Capability is required by the stated fictional slice.",
      "applicability_decision_ref": "SCENARIO-SCOPE-ASSUMPTION",
      "weight": 1,
      "mandatory": false,
      "measurement_binding_ref": "measurement-bindings/MB-I-12.json"
    }
  ],
  "gates": [
    {
      "id": "INTEGRATED-JOURNEY",
      "required_instance_ids": [
        "I-01",
        "I-03",
        "I-04",
        "I-05",
        "I-09"
      ]
    }
  ]
}
